बिरुवाका डाँठ तथा जराका बोक्राको भित्र प्रमुख अक्षसँग समानान्तर हुन गरी छेउमा रहेका मेरिस्टमेटिक तन्तुहरूलाई ल्याटेरल मेरिस्टेम भनिन्छ।	The meristematic tissue which is found inside the bark of the stem and root at the lateral side in parallel to the main axis is called lateral meristem.
बिरुवाको डाँठमा रहेको गाँठोका तलमाथि पनि मेरिस्टमेटिक तन्तु रहेका हुन्छन्।	The meristematic tissue is also found on either side of nodes.
उक्त तन्तुहरूलाई इन्टरक्यालरी मेरिस्टेम भनिन्छ।	It is known as intercalary meristem.
यी तन्तुहरूले इन्टरनोडको लम्बाइ बढाउँछन्।	It increases the length of the internode.
मेरिस्टमेटिक तन्तुका कोषहरू कोष विभाजन क्षमता गुमाइसकेपछि स्थायी तन्तुमा परिणत हुन्छन्।	The meristematic tissue is changed into permanent tissue while losing its cell division capacity.
स्थायी तन्तुमा पाइने कोषहरूमा साधारणतया कोष विभाजन हुँदैन।	Generally, cell division does not take place in permanent tissue.
यिनीहरूको निश्चित आकार र साइज हुन्छ।	It has a fixed shape and size.
यिनीहरूको कोषभित्ता बाक्ला वा पातला हुन्छ।	The cell wall is thick or thin.
यो तन्तु जीवित वा मृत कोषहरू मिलेर बनेको हुन्छ।	These tissues are made by living or non-living cells.
बिरुवामा पाइने स्थायी तन्तुहरू सरल तन्तु, जटिल तन्तु र विशिष्ट तन्तु गरी तीन प्रकारका हुन्छन्।	There are three types of permanent tissues like simple permanent tissue, complex permanent tissue, and special tissue.
उद्देश्य: बिरुवामा पाइने तन्तुको अवलोकन	Objective: Observation of plant tissue
आवश्यक सामग्री: बिरुवाको काण्ड, ब्लेड, वाच ग्लास, स्याफ्रानिन, ग्लिसरिन, कभर स्लिप, सूक्ष्मदर्शक यन्त्र	Materials: Stem of plant, blade, watch glass, safranin, glycerin, cover slip, and microscope
एउटा बिरुवाको काण्ड लिई धारिला ब्लेडको मदतले पातला सेक्सनहरू काट्नुहोस्।	Cut the small, fine, and thin sections of the stem of plants.
उक्त सेक्सनहरूलाई वाच ग्लासमा राख्नुहोस्।	Place the sections in the watch glass.
वाच ग्लासमा एक थोपा स्याफ्रानिन राख्नुहोस्।	Pour one drop of safranin in the watch glass.
कही समयपछि सबभन्दा पातला सेक्सन छानी स्लाइडमा राखी एकथापा ग्लिसरिन राख्नुहोस्।	Put a drop of glycerin in the slide and place a thin section on it.
हावा नछिर्ने गरी कभर स्लिपले छोप्नुहोस्।	Cover it with the help of a cover slip by avoiding air bubbles.
बिरुवा कोषको अस्थायी स्लाइड तयार भयो।	The temporary slide of plant cell is ready.
सूक्ष्मदर्शक यन्त्रद्वारा तयारी स्लाइड अवलोकन गरी देखिएका भागहरूको चित्र बनाउनुहोस्।	Observe the prepared slide and draw the diagram of visible parts of plant tissue.
देखिएका विभिन्न किसिमका तन्तुहरूका साइज, आकार र विशेषताका बारेमा छलफल गर्नुहोस्।	Discuss the size, shape, and features of tissues.
आवश्यकताअनुसार शिक्षकको मदत लिनुहोस्।	Take the support from your teacher as per necessity.
सरल स्थायी तन्तुहरू एक प्रकारका कोषहरू मिलेर बनेका हुन्छन्।	The simple permanent tissues are made by similar types of cells.
यिनीहरूको बनावट एकदमै सरल हुन्छ।	Their structures are very simple.
यस्ता तन्तुले सुरक्षा गर्ने, सहारा दिने तथा खाद्य पदार्थको निर्माण र भण्डारण गर्ने कार्य गर्दछ।	The functions of these tissues are protection, support, and preparation of food materials and their storage.
कोषको बनावटअनुसार यी तन्तुहरू तीन प्रकारका हुन्छन्।	On the basis of structures, these tissues are of three types.
पेरेन्काइमा तन्तु पातला भित्ता भएका जीवित कोषहरू मिलेर बनेको हुन्छ।	Parenchyma tissue is made by thin-walled living cells.
यस तन्तुमा पाइने कोषहरू गोलो र लाम्चा आकारका हुन्छन्।	The cells in this tissue are oval and elongated.
यसमा अन्तरकोषीय खाली ठाउँ हुन्छ।	It has intercellular space.
यस किसिमका तन्तुहरू डाँठ, जरा, पात, फूल र फलका नरम भागमा हुन्छन्।	This type of tissue is found in the soft part of the stem, root, leaf, flower, and fruit.
यसका साथै यो तन्तु पिथ, जाइलम र फ्लोएममा पनि पाइन्छ।	It is also found in pith, xylem, and phloem.
पात तथा हरिया डाँठमा हुने पेरेन्काइमामा क्लोरोप्लास्ट हुन्छ।	Chloroplast is present in the parenchyma of the leaf and green stem.
उक्त तन्तुलाई क्लोरेन्काइमा पनि भनिन्छ।	It is called chlorenchyma.
यसले प्रकाश संश्लेषण प्रक्रियाबाट खाना बनाउँछ।	It prepares food materials by photosynthesis.
यसले खाना बनाउन, सञ्चय गर्न तथा बिरुवालाई पुष्ट राख्न मदत गर्छ।	So, it helps to prepare food and storage.
पानीमा तैरने बिरुवाहरूका पातमा रहेका कोषहरूका बीचमा हावा भरिएका हुन्छ।	The air is present in between cells of the leaf of floating plants.
कोषका बीचमा हावाका थैलीहरू रहेको पेरेन्काइमालाई एरेन्काइमा भनिन्छ।	The air bladder containing parenchyma is called aerenchyma.
यसले हाइड्रोफाइट्सलाई पानीमा तैरिन मदत गर्छ।	In hydrophytes, it helps to float in water.
यो तन्तु बाक्ला कोष भित्ता भएका जीवित कोषहरू मिलेर बनेको हुन्छ।	This tissue is made by thick-walled living cells.
कोषको किनारा भागमा सेलुलोज र पेक्टिन जस्ता कार्बोहाइड्रेट पदार्थहरू जम्मा भएका हुन्छ।	The carbohydrate-like cellulose and pectin are deposited in the corner of the cell wall.
त्यसैले कोषभित्ता बाक्लो हुन्छ।	Therefore, the cell wall is thick.
यी तन्तुहरू काण्डका एपिडर्मिस र पातको पेटिओलमा हुन्छन्।	These tissues are located in the epidermis of the stem and petiole of the leaf.
यस तन्तुको मुख्य कार्य वृद्धि हुँदै गरेको बिरुवाका अङ्गमा दरापन ल्याउन, बिरुवालाई लचकता प्रदान गर्न हो।	The main function of these tissues is to provide mechanical strength and flexibility to the plant.
केही कोलेन्काइमा तन्तुमा क्लोरोप्लास्ट पाइन्छ।	Some collenchyma bears chloroplast.
उक्त तन्तुले प्रकाश संश्लेषणमा मदत गर्छ।	It helps in photosynthesis.
यो तन्तु बाक्ला कोष भित्तायुक्त मृत कोषबाट बनेको हुन्छ।	This tissue is made by thick-walled dead cells.
कोषहरू लाम्चो, साँघुरा र स्पिन्डल आकारका हुन्छन्।	These cells are elongated, narrow, and spindle-shaped.
कोष भित्ता सेलुलोज वा लिग्निनबाट बनेको हुन्छ।	The cell wall is made by cellulose and lignin.
कोषमा प्रोटोप्लाज्म हुँदैन।	Protoplasm is absent.
यस तन्तुको कोषको बीच भागमा साँघुरा खाली भाग रहेको हुन्छ।	It has a narrow lumen which is found between cells.
बिरुवाका जरा, काण्ड र पातको नसा, फल तथा बिउका कडा आवरणका तहमा पाइन्छ।	It is found in the root, stem, veins of the leaf, fruit, and hard seed coat.
यिनीहरूको आकारअनुसार स्केलेरेन्काइमा फाइबर र स्केलेरिड गरी दुई किसिमका स्केलेरेन्काइमा तन्तुहरू बिरुवामा पाइन्छन्।	On the basis of shape, it is of two types viz. sclerenchyma fiber and sclerids.
बिरुवालाई दरिलो बनाउनु र सिधा अड्याउनु यसको मुख्य कार्य हो।	Its main function is to make the plant strong and straight.
यसले बिरुवामा लचकता र कडापन दिन्छ।	It gives flexibility and mechanical strength to the plant.
जटिल तन्तु	Complex tissue
जटिल तन्तुहरू विभिन्न किसिमका जीवित तथा मृत कोषको समूह मिलेर बनेको हुन्छ।	Complex tissues are made by the group of different types of living and dead cells.
यी तन्तुहरू दुई वा दुईभन्दा बढी सरल तन्तुहरू मिलेर बनेका हुन्छन्।	These tissues are made by two or more than two simple tissues.
त्यसैले यिनीहरूको बनावट केही जटिल हुन्छ।	So, their structure is complex.
यिनीहरूको मुख्य कार्य संवाहन गर्ने भएकाले यिनीहरूलाई भास्कुलर तन्तु पनि भनिन्छ।	These tissues are called vascular tissue due to their conductive function.
जटिल तन्तु दुई प्रकारका हुन्छन्, ती यसप्रकार छन्।	Complex permanent tissues are of two types which are given below:
जाइलम तन्तु मृत कोषबाट बनेको हुन्छ।	Xylems are made by dead cells.
यो चार प्रकारका अवयवबाट बनेको हुन्छ।	It has four components.
ती हुन्: भेसल्स, ट्राकिड्स, जाइलम फाइबर र जाइलम पेरेन्काइमा।	They are vessels, tracheids, xylem fiber, and xylem parenchyma.
जाइलमले बिरुवामा कडापन दिने भएकाले यसलाई उड पनि भनिन्छ।	Xylem maintains the hardness of the plant so it is also known as wood.
यस किसिमको तन्तु बिरुवाको जरा, डाँठ, पात तथा अन्य भागका भित्री तहमा पाइन्छ।	This type of tissue is found in the inner part of the root, stem, leaf, and other parts.
जाइलमले जराबाट खनिज र पानी बिरुवाका विभिन्न भागमा पुर्‍याउँछ।	It conducts the water and minerals from the root to different parts of the plant.
फ्लोएम तन्तु जीवित कोषहरू मिलेर बनेको हुन्छ।	Phloem tissue is made by living cells.
यो तन्तु पनि चार किसिमका अवयवहरू मिलेर बनेको हुन्छ।	It also has four components.
ती हुन्: सिभटयुव, कम्प्यानियन सेल, फ्लोएम पेरेन्काइमा र फ्लोएम फाइबर।	They are sieve tubes, companion cells, phloem parenchyma, and phloem fibers.
यो तन्तु बिरुवाका सबै भागहरू जस्तै: जरा, डाँठ र पातमा पाइन्छ।	These tissues are found in all parts of plants like root, stem, and leaf.
यसलाई बास्ट पनि भनिन्छ।	It is also known as bast.
यसले पातमा तयार भएका खाना बिरुवाका विभिन्न भागमा पुर्‍याउँछ।	It transports the prepared food materials made in the leaf into different parts of the plant.
यसले खाना सञ्चय गर्नुका साथै बिरुवालाई आड दिने कार्य गर्छ।	It also provides mechanical support to the plant.
बिरुवामा विभिन्न किसिमका विशेष कार्यहरू गर्नका लागि खास किसिमका तन्तुहरू हुन्छन्।	There are various types of specific tissues for specific functions in plants.
उक्त तन्तुहरूलाई विशिष्ट तन्तु भनिन्छ।	These tissues are called special tissues.
यी तन्तुहरू सरल तन्तुहरू रूपान्तरण भएर बनेका हुन्छन्।	These tissues are formed by the modification of simple tissue.
यी तन्तुमा हुने कोषहरूले निष्कासन तथा स्राव गर्ने कार्य गर्दछन्।	The functions of cells of these tissues are excretion and secretion.
यी तन्तुहरू दुई प्रकारका हुन्छन्, ती हुन्: ग्लान्डुलर तन्तु र लेक्टिफेरस तन्तु।	These tissues are of two types: glandular tissue and lactiferous tissue.
ग्लान्डुलर तन्तु एक किसिमका ग्लान्डुलर कोषहरूको समूह मिलेर बनेको हुन्छ।	Glandular tissue is made by a group of similar types of glandular cells.
यी तन्तुले इन्जाइम, हर्मोन, पाचन रस, तेल, रजिन, गम आदि उत्पादन गर्छन्।	It secretes enzymes, hormones, digestive juice, oil, resin, gum, etc.
यी तन्तुहरू धतुरो, तुलसी र सल्ला जस्ता बिरुवामा पाइन्छन्।	These tissues are found in Dhaturo, Ocimum, and Pine plants.
लेक्टिफेरस तन्तु विशेष किसिमका कोषहरू मिलेर बनेको तन्तु हो।	Lactiferous tissues are made by specific cells.
यसले दूध जस्ता तरल पदार्थ उत्पादन गर्छ।	It secretes milk-like liquid .
लेटेक्सबाट गम बनाइन्छ।	Gum is prepared from latex.
पिपल, लालुपाते, कटहर, रबर, आँक जस्ता बिरुवामा लेक्टिफेरस तन्तु पाइन्छ।	It is found in plants like Ficus, Poinsettia, Jackfruit, Rubber, Calotropis, etc.
जन्तु कोषहरूको समूह मिलेर बनेको तन्तुलाई जन्तु तन्तु भनिन्छ।	The tissue made by the group of animal cells is called animal tissue.
प्रत्येक जन्तु तन्तुले एउटा निश्चित कार्य गर्छ।	Each animal tissue performs one fixed function.
जनावर तन्तुहरू सामान्यतः चार किसिमका हुन्छन्।	Generally, animal tissues are of four types:
जनावरको शरीर वा यसका अङ्गहरूको सबभन्दा बाहिरी पत्रमा रहेका कोषहरूको समूहलाई इपिथेलियल तन्तु भनिन्छ।	The group of cells that lies in the outermost covering of the body of an organism or its organs is called epithelial tissue.
इपिथेलियल तन्तु एक किसिमका कोषहरू वा विभिन्न किसिमका कोषहरू मिलेर बनेको हुन्छ।	It is made by similar or dissimilar types of cells.
यस तन्तुका कोषहरू वेसमेन्ट मेम्ब्रेनमा टाँसिएर रहेका हुन्छन्।	The cells of these tissues are attached to the basement membrane.
इपिथेलियल तन्तुले मुख्यतया ढाक्ने, बचाउने, स्राव गर्ने, निष्कासन गर्ने, सोस्ने जस्ता कार्यहरू गर्दछ।	The main functions of epithelial tissue are covering, protecting, secreting, excreting, and absorbing.
उद्देश्य: इपिथेलियल तन्तुको अवलोकन गर्नु	Objective: Observe epithelial tissue.
आवश्यक सामग्री: कुखुराको छालाको एक टुक्रा, फोरसेप, स्लाइड, कभरस्लिप, आयोडिन, सूक्ष्मदर्शक यन्त्र	Apparatus required: A piece of chicken skin, forceps, slide, cover slip, iodine, and microscope
एउटा फोरसेपले कुखुराको छालाको तह कोट्याउनुहोस्।	Peel the fine layer of chicken skin with the help of forceps.
काट्याएर आएका भागलाई सफा स्लाइडमा राखी एक थापा आयोडिन राख्नुहोस् र कभरस्लिपले छोप्नुहोस्।	Take the layer of skin in a slide by putting one drop of iodine and cover it with a cover slip.
स्लाइडलाई सूक्ष्मदर्शक यन्त्रद्वारा अवलोकन गर्नुहोस्।	Observe the slide from the microscope.
अवलोकन र छलफल	Observation and discussion
सूक्ष्मदर्शक यन्त्रद्वारा अवलोकन गर्दा देखिएको कुरा चित्रमा उतार्नुहोस् र कक्षामा प्रदर्शन गरी छलफल गर्नुहोस्।	Draw the diagram that is observed from the microscope and discuss it in class.
कोषको प्रकृति र मोटाइका आधारमा इपिथेलियम तन्तुलाई पनि विभिन्न भागमा बाँड्न सकिन्छ।	The epithelial tissue can be divided into various types on the basis of the nature of cells and thickness.
यीमध्ये महŒवपूर्ण इपिथेलियम तन्तुहरू निम्नानुसार छन्।	Some important epithelial tissues are given below:
पेभमेन्ट तन्तुमा चप्टा प्लेट जस्ता बहुभुजीय कोषहरू आपसमा टम्म मिलेर बसेका हुन्छन्।	In pavement tissue, the flat plate-like polygonal cells are compactly arranged.
यसमा कोषहरूको एकपत्र तह मात्र हुन्छ।	It has one layer of cells.
यसलाई स्क्वामस इपिथेलियम पनि भनिन्छ।	It is also known as squamous epithelium.
यी तन्तुहरूले ढाक्ने, बचाउने र छान्ने जस्ता कार्यहरू गर्दछन्।	Covering, protecting, and filtering are the functions of this tissue.
यो तन्तुले मुटु, फोक्सो, मिर्गौला आदिका बाहिरी आवरण बनाउँछ।	This tissue forms the outer covering of the heart, liver, kidney, etc.
क्युबिकल अर्थात् घनाकार कोषहरूको एक पत्रले ढाकिएर क्युबिकल इपिथेलियम बन्दछ।	Cubical epithelium is made by single-layer cuboidal cells.
यस प्रकारको तन्तुबाट मिर्गौलाभित्रका थाइराइड ग्रन्थि र निष्कासन ग्रन्थिका विभिन्न नलीहरू, गर्भाशयको भित्री भाग र श्वासनलीहरू बनेका हुन्छन्।	The nephrons of the kidney, thyroid gland, ducts of different excretory glands, inner layer of the uterus, and alveoli of the lung are made by this tissue.
यसले ढाक्न, बचाउन, स्राव गर्ने आदि कार्य गर्दछ।	Its functions are covering, protecting, and secreting.
लाम्चा आकारका कोषहरू बेसमेन्ट मेम्ब्रेनमा रहेर यो तन्तु बनेको हुन्छ।	This tissue is made by elongated cells at the basement membrane.
यसमा कोषहरूको एक पत्र तह रहेका हुन्छ।	It has one layer of cells.
यिनीहरूको सतह ससाना रौँ जस्ता सिलियाले ढाकेका हुन सक्छ।	Its surface is covered by fine, small hair-like cilia.
यस सिलियाले नजिक रहेका तरल पदार्थलाई यताउता चलाउन कार्य गर्दछ।	This cilia plays a role in clearing the liquid.
यस प्रकारका तन्तु पित्त थैली, ¥यालग्रन्थि जस्ता स्राव गर्ने अङ्गहरूमा पाइन्छ।	This tissue is found in secretory organs like the gall bladder, and salivary gland.
यसका मुख्य कार्य स्राव गर्ने र सोस्ने हुन्।	Its functions are secretion and absorption.
शरीरमा पाइने ग्रन्थिलाई स्राव इपिथेलियम कोषले ढाकेको हुन्छ।	The gland of the body is covered by glandular epithelial cells.
यस्ता कोषहरूबाट बनेको तन्तुलाई ग्लान्डुलर इपिथेलियम भनिन्छ।	It is known as glandular epithelium.
