यदि डोरीमा रिबन बाँधिएमा उक्त रिबनको चालले यसमा रिपल अगाडि बढ्दा अणुहरू यथास्थानमा तल माथि चलिरहने तथ्य अवलोकन गर्न सकिन्छ।	The periodic disturbance in electric and magnetic fields also transmits energy.
विद्युतीय र चुम्बकीय क्षेत्रमा हुने पेरियोडिक डिस्टरबेन्सले पनि शक्ति प्रसारण गर्छ।	A wave is a periodic disturbance that transmits energy.
तरङ्ग प्रसारणको दिशा र पेरियोडिक हलचल वा कम्पन एउटै दिशामा हुने तरङ्गहरू लङ्गिच्युडिनल तरङ्ग हुन्।	In a longitudinal wave, the direction of transmission of the wave and the direction of periodic disturbance or vibration is the same.
ध्वनि तरङ्ग लङ्गिच्युडिनल तरङ्गको उदाहरण हो।	The sound wave is an example of a longitudinal wave.
लङ्गिच्युडिनल तरङ्गहरू ठोस, तरल, र ग्याँस तीनओटै माध्यमा सिर्जना गर्न सकिन्छ।	Longitudinal waves can be created in all media: solid, liquid and gas.
स्लिङ्कीलाई एकनासले दायाँ बायाँ चलाउँदा यसको कुन खण्डमा रिङहरू दायाँ सर्ने र बायाँ सर्ने क्रम निरन्तर चलिरहन्छ।	In the process of moving the slinky left and right uniformly, rings of certain parts of the slinky move to the left while the rings of the other parts move to the right continuously.
यससँगै स्लिङ्कीमा उत्पन्न तरङ्ग भने अगाडि बढिरहेको देखिन्छ।	During this process, waves produced in slinky also move forward.
तरङ्ग प्रसारणको दिशा र पेरियोडिक हलचल वा कम्पन एक अर्कोसित लम्ब हुने तरङ्गहरू ट्रान्सभर्स तरङ्ग हुन्।	In a transverse wave, the direction of transmission of the wave and the direction of periodic disturbance or vibration are perpendicular to each other.
पानीमा उत्पन्न हुने तरङ्ग, डोरीमा उत्पन्न हुने तरङ्ग आदि ट्रान्सभर्स तरङ्गका उदाहरणहरू हुन्।	The wave produced on the water surface, the wave produced in rope, etc. are some examples of a transverse wave.
ठोस माध्यम र तरल माध्यममा ट्रान्सभर्स तरङ्गहरूको सिर्जना गर्न सकिन्छ तर ग्याँस माध्यमा सिर्जना गर्न सकिँदैन।	Transverse waves can be created in solid and liquid mediums but not in gas.
लङ्गिच्युडिनल तरङ्ग कम्प्रेसन र रेयरफेक्सनका रूपमा प्रसारण हुन्छ।	Longitudinal waves transmit in the form of compression and rarefaction.
तरङ्ग प्रसारणका क्रममा माध्यमका अणुहरू खाँदिएको खण्ड कम्प्रेसन हो।	The segment of the wave where molecules are crammed is compression.
अणुहरू फुकेको खण्ड रेयरफेक्सन हो।	A segment where the molecules are spread out is rarefaction.
ट्रान्सभर्स तरङ्ग क्रेस्ट र ट्रफका रूपमा प्रसारण हुन्छ।	Transverse wave transmits in the form of crest and trough.
तरङ्ग प्रसारणका क्रममा यसको मध्य भागबाट सबैभन्दा माथि उठेको भाग क्रेस्ट हो र सबैभन्दा तल दबेको भाग ट्रफ हो।	The raised part of the wave is the crest and the depressed segment is the trough.
तरङ्गको एम्प्लिच्युडले विश्राम स्थितिबाट माध्यमका अणुहरूको अधिकतम विस्थापन वा तरङ्गको मध्य भागबाट क्रेस्ट वा ट्रफसम्मको विस्थापनलाई जनाउँछ।	The amplitude of the wave indicates the maximum displacement of molecules from the rest position or distance from the mean position to the crest or trough.
स्लिङ्कीमा तरङ्ग प्रसारणका क्रममा थुप्र तरङ्ग लहरहरू सिर्जना भई पल्स अगाडि बढेको अवलोकन गर्न सकिन्छ।	During the transmission of waves in a slinky, we can observe the pulse moving forward by creating many wave cycles.
प्रतिसेकेन्ड उत्पन्न हुने तरङ्ग सङ्ख्याले तरङ्ग आवृत्ति जनाउँछ।	The number of waves produced per second is frequency.
आवृत्तिको एस.आई. एकाइ हर्ज हो।	The SI unit of frequency is Hertz.
एक पूर्ण तरङ्ग उत्पन्न हुन लाग्ने समयलाई तरङ्गको समयावधि भनिन्छ।	The time taken to produce a complete wave is the period of the wave.
सबै तरङ्गहरू एकनासले प्रसारण हुँदैनन्।	Not all waves are transmitted in the same way.
तरङ्ग प्रसारणको दर स्रोतबाट प्राप्त शक्ति, माध्यम, तरङ्गको प्रकृति आदिमा भर पर्छ।	The rate of wave transmission depends upon energy provided by the source, medium, nature of the wave, etc.
तरङ्ग प्रसारणका क्रममा प्रतिएकाइ समयमा तरङ्गले पार गर्ने दुरी तरङ्गको गति हो।	During the transmission of the wave, the distance covered by the wave in unit time is wave velocity.
यसलाई तरङ्ग लम्बाइ र तरङ्ग आवृत्तिको गुणनफलबाट प्राप्त गर्न सकिन्छ।	It is the product of wavelength and frequency.
कुनै तरङ्ग प्रशसरणको लागि माध्यमको आवश्यक पर्छ भने कुनैलाई पर्दैन।	Some waves require a medium to propagate, while others don't.
ध्वनि तरङ्ग एक यान्त्रिक तरङ्गको उदाहरण हो।	The sound wave is an example of a mechanical wave.
यान्त्रिक तरङ्ग पदार्थमा कम्पनद्वारा हुने शक्तिको प्रसारण हो।	A mechanical wave is the propagation of energy produced by the vibration in molecules of a matter.
शक्ति प्रसारणका क्रममा कम्पन हुने पदार्थलाई माध्यम भनिन्छ।	During propagation of energy, matter in which vibration occurs is medium.
यान्त्रिक तरङ्गको शक्ति माध्यममा खपत हुँदै जाँदा यसको शक्ति घट्दै जान्छ।	The energy of the mechanical wave goes on decreasing during the transmission due to absorption by the medium.
त्यसकारण यान्त्रिक तरङ्गको प्रसारण माध्यमअनुसार निश्चित सीमासम्म हुन्छ।	Thus, the mechanical wave propagates up to a certain limit according to the medium.
यान्त्रिक तरङ्गको गति ठोस, तरल र ग्याँस माध्यममा फरक फरक हुन्छ।	The velocity of a mechanical wave is different in solid, liquid and gas mediums.
यान्त्रिक तरङ्गहरू लङ्गिच्युडिनल तरङ्ग वा ट्रान्सभर्स तरङ्ग हुन्।	Mechanical waves are longitudinal or transverse waves.
सूर्यलगायत अन्य ताराहरूबाट आउने प्रकाश बाहिरी अन्तरिक्षको शून्य हुँदै पृथ्वीसम्म आइपुग्छ।	The light of the sun and other stars in space enter the earth by passing through a vacuum.
बिना कुन माध्यम प्रसारण हुने प्रकाशका तरङ्ग तथा आँखाले नदेखिने ताप बोक्ने इन्फ्रारेड तरङ्ग, अल्ट्राभायलेट तरङ्ग आदि विद्युत् चुम्बकीय तरङ्ग हुन्।	Light propagating without medium, ultraviolet rays and the invisible heat-carrying infrared rays are electromagnetic waves.
विद्युत् चुम्बकीय तरङ्गहरूका माध्यमबाट शक्तिको प्रसारण हुने विधि विकिरण हो।	Radiation is a method of energy transmission in the form of electromagnetic waves.
यी तरङ्गहरू माध्यमबिना प्रसारण हुँदा शक्ति संरक्षित रहन्छ।	Energy is conserved when these waves transmit without a medium.
जसले गर्दा विद्युत् चुम्बकीय तरङ्ग प्रकाशको गतिमा निक टाढासम्म प्रसारण हुन्छन्।	So, the electromagnetic wave propagates to a huge distance at the speed of light.
उदाहरणका लागि सूर्यमा उत्पन्न प्रकाशका तरङ्गहरू १  को गतिले प्रसारण भई लगभग १ मिनेट १ सेकेन्डमा पृथ्वीसम्म आइपुग्छन्।	For example, light waves radiated by the sun transmit at the velocity of 1  and reach the earth in 1 minutes 1 seconds.
विद्युत् चुम्बकीय तरङ्गहरू ट्रान्सभर्स तरङ्ग हुन् किनकि विद्युतीय क्षेत्र र चुम्बकीय क्षेत्रको कम्पन तरङ्ग प्रसारणको दिशासँग लम्ब हुन्छन्।	Electromagnetic waves are transverse waves because the vibration of electric and magnetic fields are perpendicular to the direction of propagation of the wave.
कृत्रिम रूपमा रेडियो ट्रान्समिटर, एक्स–रे मसिन आदि बाट विद्युत् चुम्बकीय तरङ्गहरू उत्पन्न गर्न सकिन्छ।	Radio transmitters, X-ray machines, etc. produce electromagnetic waves artificially.
तपाईलाई जानकारी भएका केही विद्युत् चुम्बकीय तरङ्गहरू जस्तै ः प्रकाश तरङ्ग, अल्ट्राभायलेट तरङ्ग आदिका स्रोत र तिनका विशेषताहरू बारे छलफल गर्नुहोस्।	Discuss the source and characteristics of electromagnetic radiation that you know, for example, light waves, ultraviolet waves, etc.
बिजुली बत्तीबाट आउने उज्यालो बोकेका तरङ्ग र रेडियो प्रसारण केन्द्रबाट सञ्चारको सङ्केत बोकेको तरङ्ग दुवै विद्युत् चुम्बकीय तरङ्गहरू हुन्।	Light waves from electric lamps and communication signal waves from the radio broadcasting center are both electromagnetic waves.
तिनीहरूको आवृत्ति र तरङ्ग लम्बाइ फरक फरक हुन्छ।	They have different frequencies and wavelengths.
सब विद्युत् चुम्बकीय तरङ्गहरूलाई बढ्दो आवृत्ति अर्थात् घट्दो तरङ्ग लम्बाइका आधारमा गरिएको वर्गीकरण विद्युत् चुम्बकीय वर्णपट हो।	The entire range of waves from very low frequency to very high frequency is called the electromagnetic spectrum.
रेडियो तरङ्ग, माइव्रmोवेब, इन्फ्रारेड तरङ्ग, प्रकाश, अल्ट्राभायलेट तरङ्ग, एक्स–रे र गामा रे विद्युत् चुम्बकीय वर्णपट निर्माण गर्ने तरङ्गहरू हुन्।	Radio waves, microwaves, infrared rays, light, ultraviolet rays, X-rays and gamma rays are the different parts of the electromagnetic spectrum.
विद्युत् चुम्बकीय वर्णपटको एउटा छेउमा सबैभन्दा लामो तरङ्ग लम्बाइ अर्थात् कम आवृत्ति भएका रेडियो तरङ्गहरू रहेका छन्।	One end of the electromagnetic spectrum contains radio waves having the longest wavelength and the least frequency.
यसको अर्को छेउमा सबैभन्दा छोटो तरङ्ग लम्बाइ अर्थात् सबैभन्दा बढी आवृत्ति भएका गामा रे रहेका छन्।	Gamma rays having the shortest wavelength and maximum frequency are kept at the other end.
गामा रे, एक्स–रे जस्ता छोटो तरङ्ग लम्बाइ भएका किरणहरूले बढी शक्ति बोकेका हुन्छन्।	Waves having shorter wavelengths such as X-ray and gamma-ray carry more energy.
रेडियो तरङ्गहरूको लम्बाइ सयौँ किलोमिटर देखि १ सम्म हुन्छ।	The wavelength of radio waves ranges from 1 meter to hundreds of kilometers.
यी तरङ्गहरूले जीवहरूको शरीरका कोषहरूलाई असर नगर्ने भएकाले उपयोगका लागि शुरक्षित हुन्छन्।	It does not affect any living cell and it is safe for living beings.
रेडियो तरङ्ग निम्नलिखित कार्यमा उपयोग गरिन्छ।	Radio waves are used in the following ways:
ट्रान्समिटरमा रेडियो तरङ्ग उत्पन्न गरी रेडियो, टिभी आदिको सञ्चारका सङ्केत प्रसारण गरिन्छ।	Radio waves are produced by a transmitter and transmitted in the form of a communication signal on radio and TV.
रेडियो टेलिस्कोपका मदतले बाह्य अन्तरिक्षबाट आएका रेडियो तरङ्ग ग्रहण गरी ब्रह्माण्डका बारेमा अध्ययन गरिन्छ।	A radio telescope helps to study the universe by capturing radio waves emitted by outer space.
यसको उपयोग निम्नलिखित कार्यका लागि गरिन्छ।	It is used in the following ways:
माइक्रोवेब ओभनमा उत्पन्न हुने माइक्रोवेबले पानीका अणुहरू कम्पन हुँदा तात्छन् र खाने कुरा पाक्छ।	Due to microwaves produced in a microwave oven, water molecules vibrate and heat up. So, food is cooked.
रडार सञ्चारमा माइक्रोवेबको प्रयोग गरिन्छ।	Microwaves are used in radar communication.
हवाई ट्राफिक नियन्त्रणमा सर्भिलेन्स राडारको प्रयोग गरिन्छ।	It is used in Airport Surveillance Radar to control air traffic.
राडार स्पिड गनको प्रयोगबाट सडकमा गुडिरहेका सवारी साधनको गति मापन गरिन्छ।	The radar speed guns measure the speed of vehicles.
सञ्चारका प्रविधिमा सङ्केत प्रसारणका लागि पनि माइक्रोवेबको प्रयोग गरिन्छ।	Microwaves are used as a signal of communication technology.
भू उपग्रह सञ्चार, मोबाइल, वाइफाइ, ब्लुटुथ आदि प्रविधिमा माइक्रोवेबको प्रयोगले सञ्चार स्थापित हुन्छ।	These waves are used in Satellite communication, Mobiles, Wi-Fi, and Bluetooth technology.
यसको उपयोग निम्नलिखित कार्यका लागि गरिन्छ।	It is used in the following ways:
माइक्रोवेब ओभनमा उत्पन्न हुने माइक्रोवेबले पानीका अणुहरू कम्पन हुँदा तात्छन् र खाने कुरा पाक्छ।	Due to microwaves produced in a microwave oven, water molecules vibrate and heat up. So, food is cooked.
रडार सञ्चारमा माइक्रोवेबको प्रयोग गरिन्छ।	Microwaves are used in radar communication.
हवाई ट्राफिक नियन्त्रणमा सर्भिलेन्स राडारको प्रयोग गरिन्छ।	It is used in Airport Surveillance Radar to control air traffic.
राडार स्पिड गनको प्रयोगबाट सडकमा गुडिरहेका सवारी साधनको गति मापन गरिन्छ।	The radar speed guns measure the speed of vehicles.
सञ्चारका प्रविधिमा सङ्केत प्रसारणका लागि पनि माइक्रोवेबको प्रयोग गरिन्छ।	Microwaves are used as a signal of communication technology.
भू उपग्रह सञ्चार, मोबाइल, वाइफाइ, ब्लुटुथ आदि प्रविधिमा माइक्रोवेबको प्रयोगले सञ्चार स्थापित हुन्छ।	These waves are used in Satellite communication, Mobiles, Wi-Fi, and Bluetooth technology.
इन्फ्रारेड को अर्थ रातोको मुनि भन्ने हुन्छ।	Infrared means below red.
यी तरङ्गहरूको आवृत्ति रातो रङको प्रकाश तरङ्गभन्दा कम तर तरङ्ग लम्बाइ रातो रङको प्रकाशको भन्दा लामो हुन्छ।	The frequency of infrared waves is less than red light, but their wavelength is comparatively more.
तीव्रता भएका इन्फ्रारेड तरङ्ग शरीरमा पर्दा तातोपनको अनुभुति हुन्छ।	When infrared waves with high-intensity strike our body, we feel the sensation of heat.
यिनको तरङ्ग लम्बाइ १०^-६ मिटर देखि ७.५ × १०^-५ मिटर सम्म हुन्छ।	Their wavelength ranges from 10^-6 m to 7.5 × 10^-5 m.
यी तरङ्गको उपयोग निम्नअनुसारका कार्यका लागि गरिन्छ।	Infrared rays are used in the following ways:
इन्फ्रारेड हिटर, कुकर आदिमा इन्फ्रारेड तरङ्गबाट ताप उत्पन्न गरिन्छ।	Heat is produced in a cooker, infrared heater, etc. by infrared rays.
इन्फ्रारेड विकिरणको तीव्रताका आधारमा रेडिएसन थर्मोमिटरले शरीरको तापक्रम मापन गर्छ।	A radiation thermometer measures the body temperature based on the intensity of the infrared ray radiation.
इन्फ्रारेड सिसिटिभी क्यामरा मा आँखाले नदेखिने इन्फ्रारेड तरङ्गका माध्यमबाट रातीको समयमा पनि निगरानी गर्न सकिन्छ।	Infrared rays are used in infrared closed-circuit television cameras and thermal imaging cameras to detect nighttime activities.
रिमोट सेन्सिङ प्रविधिमा इन्फ्रारेड तरङ्गको प्रयोग गरिन्छ।	Infrared rays are used in remote sensing technology.
टिभी अन/अफ गर्न खेलौना गाडी चलाउन तथा ड्रोनलाई नियन्त्रण गर्न रिमोटबाट इन्फ्रारेड तरङ्गका रूपमा सङ्केत पठाइन्छ।	The signals are produced by a remote to switch the TV on/off, operate a toy car, and control a drone.
इन्फ्रारेड टेलिस्कोपको प्रयोगद्वारा अन्तरिक्षको अनुसन्धान गरिन्छ।	Astronomers observe different objects across the universe by studying the infrared rays they emit.
प्रकाश समूहका तरङ्गलाई हाम्रो आँखाको रेटिनाले ठम्याउन सक्छ।	The retina of the human eyes can recognize visible light waves.
आँखाले देखिने रङहरूमध्ये रातो प्रकाशका तरङ्गहरूको तरङ्ग लम्बाइ सबैभन्दा लामो  र बजनी रङका तरङ्गहरूको तरङ्ग लम्बाइ सबैभन्दा छोटो  हुन्छ।	Among the visible light waves, red light has the longest wavelength, and violet has the shortest wavelength.
प्रकाशको स्रोतबाट आएका तरङ्गहरू कुन वस्तुमा पर्दा परावर्तन हुन्छन्।	The light waves from the source reflect when they strike a certain object.
ती परावर्तित तरङ्गहरू हाम्रो आँखामा प्रवेश गर्दा वस्तुलाई देख्न सकिन्छ।	When those reflected rays enter our eyes, we can see the objects.
प्रकाश तरङ्गको उपयोग निम्नलिखित कार्यका लागि गरिन्छ।	Visible light waves are used in the following ways:
वस्तुहरूलाई देख्न।	We use it for vision.
बोटबिरुवाहरूमा प्रकाशबाट प्राप्त शक्तिबाट प्रकाश संश्लेषण प्रक्रिया हुन्छ।	The photosynthesis process occurs in plants by absorption of visible light.
प्रकाश तरङ्गका कारणले टिभी मोबाइल आदिका डिस्प्ले स्क्रिनमा आकृति देखिन्छ।	Visible lights are used on display screens such as mobiles, televisions and others.
प्रकाश तरङ्ग प्रयोग गरी अप्टिक फाइबरद्वारा सञ्चारका सङ्केत प्रसारण गरिन्छ।	We can transmit signals of communication through optic fibers by using visible light.
