गुरुत्वाकर्षण बलसम्बन्धी नियम र चालसम्बन्धी नियमहरू सर आइज्याक न्युटनले प्रतिपादन गरेका थिए।	The law of gravitational force and law of motion were invented by Sir Issac Newton.
त्यसैगरी स्टेफेन हकिन्सले ब्रह्माण्डसम्बन्धी बृहत् अध्ययन गरेका थिए।	Similarly, Stephen Hawking studied the details of the universe.
बल, चाल, शक्ति तथा अन्य भौतिक प्रक्रियासम्बन्धी अध्ययन गर्ने विषयलाई भौतिक शास्त्र भनिन्छ।	The field that studies the physical phenomena like force, motion, energy etc. is called physics.
भौतिक शास्त्रसम्बन्धी अध्ययन गर्ने वैज्ञानिक भौतिक शास्त्री  हुन्।	The scientists who study physics are physicists.
भौतिक विज्ञानअन्तर्गत परमाणुदेखि ब्रह्माण्डसम्मका भौतिक प्रक्रियाहरूको अध्ययन गरिन्छ।	Under physics, the phenomena of the atom to the universe are studied.
जोन डाल्टनले परमाणुको बनावटसम्बन्धी सिद्धान्त प्रतिपादन गरेका थिए।	The theory of atomic structure was invented by John Dalton.
यसैगरी दिमित्री मेन्डलिभले तत्वका गुणहरूको अध्ययन गरी तिनलाई पारमाणविक भारका आधारमा वर्गीकरण गरेका थिए।	Similarly, Dmitri Mendeleev studied the properties of elements and classified them on the basis of atomic weight.
पदार्थ र तिनका गुणहरूमा कसरी परिवर्तन आउँछ भनी व्यवस्थित अध्ययन गरिने क्षेत्र रसायन शास्त्र हो।	The field that studies the matter and how their properties change, is chemistry.
रसायन शास्त्र अध्ययन गर्ने वैज्ञानिकहरू रसायन शास्त्री हुन्।	The scientists who study chemistry are chemists.
रसायन विज्ञानअन्तर्गत परमाणु र अणुका आधारमा पदार्थका गुणहरू अध्ययन गरिन्छ।	Under chemistry, the properties of matter on the basis of atom and molecule are studied.
यसअन्तर्गत सामान्य रासायनिक प्रक्रियादेखि न्युक्लियर प्रक्रियासम्मको अध्ययन पर्दछ।	It includes the study of simple chemical reactions to nuclear reactions.
माथि उल्लिखित तीन मुख्य क्षेत्रहरूबाट प्राप्त ज्ञानका आधारमा बनेका विज्ञानका केही विशिष्ट क्षेत्रहरू पनि छन्।	There are some other specific fields of science which come under the above three main fields.
यस्ता क्षेत्रहरूलाई अन्तरविषयक क्षेत्रहरू मान्न सकिन्छ।	They are considered as interdisciplinary fields.
भूविज्ञान, अन्तरिक्ष विज्ञान, कृषि विज्ञान, वातावरण विज्ञान आदि अन्तरविषयक क्षेत्रका उदाहरण हुन्।	Geology, astronomy, agriculture, environment science etc. are the examples of interdisciplinary fields.
गाढा अम्लबाट फिक्का अम्ल कसरी बनाइन्छ ?	How is diluted acid made from the concentrate acid?
अल्कोहललाई बिकरमा राखी तताउँदा के हुन्छ ?	What happens when alcohol is heated in a beaker?
वैज्ञानिक अध्ययनमा प्रयोगात्मक कार्यहरू गरिन्छन्।	The experimental works are conducted in scientific study.
प्रयोगशालामा तथा बाहिरी वातावरणमा विभिन्न प्रयोगात्मक कार्य गर्दा सावधानी अपनाउनुपर्छ।	Precaution must be followed while conducting various experimental works in the laboratory or in the outer environment.
सावधानीबिना कार्य गर्दा दुर्घटना हुन सक्छ।	Accident may happen when precaution is not followed properly.
अल्कोहललाई बिकरमा राखी तताउँदा बल्छ र दुर्घटना हुन्छ।	Alcohol may burn while heating in the beaker and may cause an accident.
यसबाट बच्न पानीमा राखी तताउँदा सुरक्षित हुन्छ।	To prevent this, it is safe to heat it by keeping it in hot water which is called a water bath.
जसलाई वाटरबाथ भनिन्छ।	This is called a water bath.
त्यस्तैगरी कडा अम्ललाई फिक्का अम्ल बनाउँदा अम्लमा पानी हाल्नु हुँदैन।	Similarly, the water is not directly added to acid for its dilution.
पानीमा विस्तारै अम्ल राख्नुपर्छ।	Instead, the acid is kept slowly in the water.
यसरी कुनै पनि किसिमका प्रयोग गर्दा होसियारीपूर्वक काम गर्नुपर्छ।	So, any experiment has to be done carefully.
प्रयोगात्मक कार्य गर्दा अपनाउनुपर्ने सुरक्षा उपायहरू निम्नअनुसार छन् ः	The following are the safety measures to be followed during the experiment:
शिक्षकको उपस्थितिमा मात्र प्रयोग गर्नुपर्छ।	The experiment is done only in the presence of a teacher.
प्रयोगशालामा काम गर्दा बिद अयबत, चस्मा, पन्जा आदि सुरक्षाका सामग्रीहरू प्रयोग गर्नुपर्छ।	The safety instruments like lab coat, safety glasses, gloves etc. are used while working in the lab.
कुनै दुर्घटना भएमा शिक्षकलाई तुरुन्त खबर गर्नुपर्छ।	If any accident happens, it should be immediately informed to the teacher.
कुनै उपकरण चलाउनुभन्दा पहिले यसको बारेमा जानकारी हुनुपर्छ।	One needs to know the information about any device before using it.
प्रयोग गर्दा रसायन चाहिने जति मात्रामा मात्र लिई प्रयोग गर्नुपर्छ।	The chemicals must be taken in adequate amounts while doing experiments.
रसायन प्रयोग गर्दा सावधानी अपनाउनुपर्छ।	Safety measures are to be followed while using chemicals.
प्रयोग गर्दा भ्mयाल ढोका खुला राख्नुपर्छ।	The door and window must be opened during the experiment.
कडा अम्ल चाहिएमा शिक्षकलाई खबर गर्नुपर्छ।	The teacher should be informed if concentrated acid is required.
रसायन प्रयोग गर्दा चाख्नु हुँदैन।	Chemicals should not be tasted while using them.
प्रयोग गरिसकेपछि प्रयोग गरेको ठाँउ सफा गर्नुपर्छ र प्रयोग गरेका उपकरणहरू पूर्व स्थानमा राख्नुपर्छ।	The experimental place should be cleaned after the experiment and instruments should be kept in their respective places.
प्रयोगपछि साबुन पानीले हात धुनुपर्छ।	Hands should be washed with soap and water after finishing the experiment.
विज्ञानको विकाससँगै विभिन्न कार्यहरू सजिला गरी छिटा गर्नका लागि विभिन्न उपायहरूको खोजी भयो।	In the course of scientific developments, various efforts have been made to make work faster and easier.
विभिन्न मानिसले वैज्ञानिक अध्ययनबाट प्राप्त निष्कर्षबाट प्रविधिसँग सम्बन्धित उपकरणहरूको आविष्कार गरे।	The technology-related instruments are invented by scientists as a result of scientific study.
जेम्स वाटले बास्प इन्जिनको विकास गरेका थिए।	For example, James Watt discovered the steam engine.
यसका आविष्कारबाट यातायातका प्रविधिमा अकल्पनीय रूपान्तरण भएको थियो।	The discovery of the steam engine led to an outstanding transformation in transportation technology.
पानीको बाफबाट बिजुली उत्पादन गर्न अर्को महत्वपूर्ण आविष्कार हो।	Another important invention is the generation of electricity from a steam engine.
उदाहरणका लागि पारमाणविक भट्टीमा जनेरेटरसँग जोडिएको टर्बाइनलाई पानीका बाफले घुमाएर बिजुली उत्पादन गरिन्छ।	In this process, the turbine of the generator is rotated with the help of water vapor in the electricity production plant.
प्रविधिको विकाससँगै त्यसका उचित व्यवस्थापन पनि आवश्यक हुन्छ।	Along with the development of technology, its proper management is also essential.
माथि उल्लिखित बास्प इन्जिनमा पानी तताउन प्रयोग हुने कोइलाले अत्यधिक मात्रामा वायु प्रदूषण गर्‍यो।	The coal used for heating water in the steam engine caused excessive air pollution.
त्यस्तै आणविक भट्टीबाट उत्पन्न हुने उपउत्पादनको व्यवस्थापन तथा यसका सुरक्षा निकै चुनौतीपूर्ण छ।	Similarly, the security and management of byproducts of nuclear power plants is too challenging.
उदाहरणका लागि जापानको फुकुशिमामा सन् २०११ मा गएको भूकम्पले पारमाणविक भट्टी भत्कन गई विनाशकारी विकिरणहरू वातावरणमा छरिएका थिए।	For example, in 2011 the atomic power plant was damaged in Fukushima of Japan by a tsunami and toxic radiation was released into the environment.
तसर्थ विज्ञान तथा प्रविधिका उपलब्धिसँगै चुनौतीहरू पनि जोडिएका छन्।	So, the challenges are also connected with achievements in science and technology.
युक्रेनको चेर्नोबिलमा सन् १९८६ मा भएको पारमाणविक भट्टी विस्फोटन भएर छरिएको विकिरणले गर्दा युक्रेनलगायत यसका आसपासका देशहरूमा धनजनको ठुलो क्षति भएको थियो।	In 1986, the explosion of the atomic power plant in Chernobyl of Ukraine released the radiation which caused the destruction of human health and death in and around Ukraine.
सन् १९८४ मा भारतको भोपालमा भएको ग्याँस चुहावटका कारणले करिब २०,००० जनाको ज्यान गएको थियो।	In 1984, the gas leak in Bhopal, India caused the death of around 20,000 people.
पोषण प्रक्रियाका आधारमा कुन कुन जीवहरू समान र कुन कुन फरक होलान् ?	On the basis of nutrition, which organisms are similar and which are dissimilar?
प्रजनन प्रक्रियाका आधारमा यिनीहरूबिच के भिन्नता होला ?	What are the differences between them in terms of reproduction?
यी जीवहरूलाई कम विकसितबाट बढी विकसितको क्रममा कसरी मिलाउन सकिन्छ ?	How are these organisms arranged from primitive to advanced order?
हाम्रा वरपर विभिन्न प्रकारका जीवहरू पाइन्छन्।	There are different types of organisms in our surroundings.
शारीरिक बनावट, बासस्थान र शारीरिक प्रक्रियाका आधारमा केही जनावरहरू समान हुन्छन् भने केही भिन्न हुन्छन्।	On the basis of body structure, habitat and life process, some animals are the same while some are different.
जस्तैः कुनै जीवहरू पानीमा बस्छन् त कुनै जमिनमा बस्छन्।	Like some organisms live in water whereas some live on land.
हरितकण भएका वनस्पतिहरू स्वपोषक हुन्छन् भने अन्य जीवहरू परपोषक हुन्छन्।	The plants with chlorophyll are autotrophic and rest organisms are heterotrophic.
अमिबा, पारामेसियमलगायतका सूक्ष्म जीवहरूका जीवन प्रक्रियाहरू सामान्य किसिमका हुन्छ भने स्तनधारी जीवहरूमा विकसित जीवन प्रक्रियाहरू हुन्छ।	The life processes of microorganisms like Amoeba, Paramecium are simple but advanced in Mammalia.
यिनीहरूमा पाइने विशेषताहरू शारीरिक बनावट, खाना खाने प्रक्रिया, प्रजनन र क्रम विकास आदिका आधारमा सजीवलाई विभिन्न समूहमा छट्याउन सकिन्छ।	The living beings are categorized into different groups on the basis of characteristics like body structure, feeding mode, reproduction, evolution, and so on.
एउटै प्रकृति र गुण भएका सजीवहरूलाई एउटै समूह बनाई राखिन्छ।	The living beings with similar properties and nature are kept in the same group.
यसरी सजीवहरूलाई तिनीहरूमा पाइने समान र असमान विशेषताहरूका आधारमा समूह र उपसमूहमा विभाजन गरिने प्रक्रियालाई सजीवको वर्गीकरण भनिन्छ।	So, the process of dividing living beings into groups and subgroups according to their similar and dissimilar properties is called classification of living beings.
जीवहरूको वर्गीकरणको महŒव	Importance of classification of living beings
सजीवहरूको वर्गीकरणका अध्ययनबाट निम्नलिखित तथ्यहरू थाहा पाउन मदत गर्छ।	Classification of living beings helps to identify the following facts.
जीवहरूको वर्गीकरणले क्रमविकाससम्बन्धी तथ्यहरू पत्ता लगाउन मदत गर्छ।	It helps to find the facts about the evolution of organisms.
यसको मदतबाट सजीवहरूका बारेमा छोटो समयमा नै अध्ययन गर्न सकिन्छ।	It helps to study the living beings in a short time.
कुनै भौतिक परिमाणको मापनलाई वैज्ञानिक सङ्केतमा व्यक्त गर्ने गरिन्छ।	The physical quantity is expressed in scientific notation.
विज्ञानका विभिन्न प्रयोगात्मक कार्यहरू गर्दा वस्तुका मापन गरिन्छ।	The measurement of an object is taken while conducting different scientific experimental work.
त्यसबाट सङ्कलन गरिएका तथ्याङ्कहरूको विश्लेषण गरी निष्कर्ष निकालिन्छ।	The conclusion is drawn after analysis of data collected from the experiment.
वैज्ञानिक अध्ययन विधिमा अध्ययनका क्षेत्रअनुसार अति नै सूक्ष्म ब्याक्टेरिया, भाइरसदेखि ठुला ठुला पिण्डहरू जस्तैः पृथ्वीका पिण्ड, सूर्यका पिण्ड, आदि सँग सम्बन्धित नापका तथ्याङ्क सङ्कलन गर्नुपर्न हुनसक्छ।	According to the field of scientific study, the data related from very small microorganisms like bacteria, viruses to the size of large objects like the mass of earth, mass of sun etc. should be collected.
यस क्रममा साना तथा ठुला सङ्ख्याको प्रयोग गर्नुपर्छ।	The number of small and large scales should be used in this process.
उदाहरणका लागि एउटा भाइरसको साइज ०.०००००००००१ मिटर र पृथ्वी र सूर्यबिचका दुरी १५०,०००,००० किलोमिटरलाई जस्ताका त्यस्तै लेख्न कठिनाइ हुन्छ।	For example, it is difficult to write the size of a virus as 0.00000000001 meter and the distance between earth and sun as 150,000,000 kilometers.
यस किसिमका साना तथा ठुला सङ्ख्यालाई १० को घाताङ्कमा लेखिन्छ, यसलाई वैज्ञानिक सङ्केतन भनिन्छ।	It is written in the power of ten which is called scientific notation.
वैज्ञानिक सङ्केतनको प्रयोगले धेरै साना सङ्ख्या वा ठुला सङ्ख्यालाई सजिलैसँग व्यक्त गर्न सकिन्छ।	It is easy to express small or big numerals by scientific notation.
वैज्ञानिक अध्ययनमा आकाशीय पिण्डहरू बिचको दुरीको मापनका साथै आँखाले देख्न नसकिने अति सूक्ष्म वस्तुका साइजलाई सजिलैसँग वैज्ञानिक सङ्केतनमा व्यक्त गर्न सजिलो हुन्छ।	In scientific study, it is easy to denote the distance between heavenly bodies as well as the size of small micro objects.
उदाहरणका रूपमा पूर्व पश्चिम राजमार्गको लम्बाइ करिब १००० किमी छ।	For example, the length of the East-West Highway is about 1000 km.
यसलाई वैज्ञानिक सङ्केतमा लेख्दा अन्तमा रहेको दशमलवका स्थानलाई एक स्थान बायाँ सारेर दशको घाताङ्कमा लेखिन्छ।	It is written in scientific notation by moving the decimal point one place to the left and expressing it in the power of ten.
माथिको तालिकामा ठुला परिमाण र साना परिमाणका नापहरूलाई मेट्रिक प्रणालीमा व्यक्त गरिएको छ।	In the above table, the small and big units are expressed in the metric system.
जसमा साना नापका इकाइका अगाडि प्रयोग भएका मिली, माइक्रो तथा ठुला नापका इकाइको अगाडि प्रयोग भएका किलो, मेगा आदि मेट्रिक उपसर्ग हुन्।	Where notation used in front of small units like milli, micro and kilo, mega in big units are the metric prefixes.
ठुलो तथा साना नापका लागि प्रयोग हुने मेट्रिक उपसर्गहरूलाई तलको तालिकामा देखाइएको छ।	The metric prefixes for big and small units are given in the table.
चित्रमा स्टपवाच, छोटो स्केल र प्रोट्याक्टर देखाइएको छ।	The stopwatch, short scale, and protractor are shown in the diagram.
यी उपकरणहरू कुन कुन भौतिक परिमाण मापनमा प्रयोग गरिन्छ?	What are the physical quantities that these instruments are used to measure?
यी उपकरणबाट मापन गर्न सकिने सबैभन्दा साना परिमाणको मान कति हुन्छ?	What is the value of the smallest quantity that can be measured from these instruments?
यसप्रकार हामील प्रयाग गर्न उपकरणअनुसार न्यूनतम नाप पनि फरक फरक हुन्छ, जस्तैः हाते घडीको न्यूनतम नाप सेकेन्ड हुन्छ भने डिजिटल स्टपवाचको सेन्टिसेकेन्ड हुन्छ।	In this way, the minimum measurement also varies according to the equipment used, for example, the minimum measurement of a wristwatch is seconds while that of a digital stopwatch is centiseconds.
वैज्ञानिक अध्ययनमा न्यूनतम नापको महŒव धेरै हुन्छ।	The minimum measurement is of great importance in scientific study.
यसका मदतल मापन सही तरिकाले गर्न सकिन्छ।	With its help, measurements can be done accurately.
तथ्याङ्कहरूको सङ्कलन र विश्लेषण गरी निष्कर्षमा पुग्न सकिन्छ।	Data can be collected and analyzed to reach a conclusion.
ढुङ्गा वा गुच्चालाई २ मिटर माथिबाट खसालेर पातामा ठाकिन आउन समय अभिलख गर्दा तिनै पटकमा समय फरक फरक आउन सक्छ।	The time period taken by marble or stone to strike a tin sheet from 2 meters height may differ all three times.
यसरी समय मापन गर्दा एकै पटकमा सही हुँदैन।	In this process, the measurement of time is not accurate at once.
यसलाई दुई तीन पटक दोहो¥याउँदा यसको औसतले सही मापन दिन्छ।	Its average measurement is regarded as more accurate than a single one.
