अजैविक पक्षअन्तर्गत माटो, प्रकाश, हावा, पानी, आद्रता जस्ता विभिन्न किसिमका निर्जीव वस्तुहरू तथा भौतिक तत्वहरू पर्दछन्।	Abiotic factors include various types of non-living things and physical environments like soil, light, air, water, humidity, etc.
पारिस्थितिक पद्धतिअन्तर्गतका जैविक र अजैविक पक्षहरूबीच एक किसिमका शक्ति र अन्य वस्तुहरूको निरन्तर आदान प्रदान भैरहन्छ।	In an ecosystem, the energy and other substances are transferred continuously between biotic and abiotic components.
यस किसिमको शक्ति प्रवाहले गर्दा नै पारिस्थितिक पद्धतिमा सन्तुलन भैरहन्छ।	The ecosystem is balanced by this energy transfer mechanism and biotic interaction.
सबै किसिमका पारिस्थितिक पद्धतिमा अजैविक र जैविक गरी दुई प्रकारका तत्वहरू हुन्छन्।	Biotic and abiotic are two types of components in the ecosystem.
ती तत्वहरूको वर्णन निम्नानुसार रहेको छ।	These components are described below.
कुनै पनि स्थानको पारिस्थितिक पद्धतिमा प्रभाव पार्न सक्ने निर्जीवहरूलाई अजैविक अवयव भनिन्छ।	The non-living things that affect the ecosystem of any place are called abiotic components.
अजैविक तत्वअन्तर्गत हावा, सौर्य ऊर्जा, तापक्रम, माटो, पानी, आद्रता आदि पर्दछन्।	It includes air, solar energy, temperature, soil, water, humidity, etc.
अजैविक तत्व र जैविक तत्वहरू एक अर्कामा निर्भर र अन्तरसम्बन्धित हुन्छन्।	The biotic and abiotic components are interrelated to each other.
अजैविक तत्वहरूलाई विस्तृत रूपमा निम्नानुसार उल्लेख गर्न सकिन्छ।	Below are the details of abiotic components:
अजैविक तत्वहरूमध्ये हावा एक महŒवपूर्ण तत्व हो।	Air is an important abiotic component.
वायुमण्डलमा विभिन्न किसिमका ग्याँसहरू जस्तै नाइट्रोजन, अक्सिजन, कार्बन डाइअक्साइड, पानीका बाफ आदि रहेका हुन्छन्।	The atmosphere contains different types of gases like nitrogen, oxygen, carbon dioxide, water vapor, etc.
हरिया वनस्पतिले खाना बनाउँदा कार्बन डाइअक्साइड लिन्छन् र अक्सिजन ग्याँस फाल्छन्।	Green plants take carbon dioxide during photosynthesis and release oxygen.
मानिसलगायत वनस्पति तथा अन्य जीवजन्तुले श्वास लिँदा अक्सिजन ग्याँस लिन्छन् र कार्बन डाइअक्साइड फाल्छन्।	Humans and other animals take oxygen and release carbon dioxide during respiration.
यसरी जीवजन्तु र वनस्पतिहरूबीच आपसमा सम्बन्ध कायम रहेको हुन्छ।	In this way, the relationship is maintained between plants and animals.
नाइट्रोजन तत्व वनस्पतिहरूमा क्लोरोफिल बनाउन आवश्यक पर्छ जसको मदतले बिरुवाहरूले प्रकाश संश्लेषण क्रियाबाट खाना बनाउँछन्।	Nitrogen is essential for chlorophyll synthesis in plants and plants prepare food by photosynthesis.
वायुमण्डलमा भएको नाइट्रोजन घुलनशील नाइट्रेट यौगिकमा परिणत हुन्छ र बिरुवाका जराले सोसेर लिन्छ।	The atmospheric nitrogen is converted into soluble nitrate which is absorbed by the root of the plant.
ती जलवाष्पहरूले जलचक्रमा महŒवपूर्ण भूमिका खेल्छन्।	Water vapor plays an important role in the water cycle.
त्यस गरी पानीका बाफ वायुमण्डलमा रहनाले वायुमण्डलमा आद्रता बनाउँछ।	The atmospheric humidity is increased by water vapor.
त्यसैले हावा पारिस्थितिक पद्धतिको एक महŒवपूर्ण र नभई नहुने तत्व हो।	So, air is an important factor in the ecosystem.
सौर्य ऊर्जाले वातावरणमा पाइने बोटबिरुवा, जनावर र अन्य जीवजन्तुका जीवन पद्धतिमा महŒवपूर्ण भूमिका खेल्दछ।	Solar energy plays an important role in the life processes of plants, animals, and other organisms in the environment.
सूर्यबाट प्राप्त हुने प्रकाश र ताप शक्तिले सजीवहरूको जीवनमा महŒवपूर्ण भूमिका खेलेका हुन्छन्।	The heat and light energy of the sun play an important role in the life of living beings.
सौर्य ऊर्जाको उपस्थितिमा बोटबिरुवाहरूले प्रकाश संश्लेषण प्रक्रियाद्वारा आफ्नो खाना तयार गर्छन्।	The plant prepares its food in the presence of solar energy.
भौगोलिक कारणले गर्दा सबै स्थानमा समान रूपमा सौर्य ऊर्जा प्राप्त हुँदैन।	Solar energy is not obtained uniformly due to geographical conditions.
यसले गर्दा विभिन्न स्थानका हावापानी, त्यहाँ हुने वर्षाको मात्रा तथा खाद्यान्न उत्पादन आदिमा भिन्नता पाइन्छ।	So, the climate, rainfall, and food production differ from place to place.
त्यसैले विभिन्न ठाउँमा पाइने जनावर तथा बोटबिरुवा पनि फरक-फरक हुन्छन्।	So, the plants and animals are also different in various places.
सूर्यबाट प्राप्त हुने तापले वायुमण्डलको तापक्रम सन्तुलित राख्न मदत गर्छ।	The solar heat helps to balance the atmospheric temperature.
यसले जीवहरूको जीवन प्रक्रिया सहज बनाउँछ।	It makes the life process of an organism easy.
तापक्रमका आधारमा फरक-फरक ठाउँमा फरक-फरक किसिमका बिरुवा उम्रन्छन्।	Different types of plants are found in different places based on temperature.
सूर्यबाट आउने तापले जलचक्र कायम गर्न महŒवपूर्ण भूमिका खेलेको हुन्छ।	Solar heat plays an important role in maintaining the water cycle.
गुफाभित्र र समुद्रको धेरै गहिराइमा प्रशस्त मात्रामा जनावर र वनस्पति निकै कम मात्रामा पाइने कारण के होला?	What is the reason behind the occurrence of fewer animals and plants in the cave and deep sea?
जन्तु तथा वनस्पतिहरूका लागि पानी अति आवश्यक तत्व हो।	Water is an important factor for plants and animals.
बोटबिरुवाहरूमा हुने प्रकाश संश्लेषण प्रक्रियाका लागि पानी महŒवपूर्ण छ।	Water is important in photosynthesis.
त्यसै गरी जन्तु तथा वनस्पतिको शरीर निर्माणमा पानीको आवश्यकता पर्दछ।	Similarly, water is essential for bodybuilding.
मानिस, पशुपन्छी, आदिले पोखरी, ताल, कुवा, झरना, नदी तथा समुद्र आदिका पानी आफ्ना जीवनका लागि प्रयोग गर्छन्।	Humans, animals, etc. use water from ponds, lakes, wells, waterfalls, rivers, and seas in their life.
जैविक वस्तुको जीवन सञ्चालन गर्नका लागि पानी अपरिहार्य छ।	Water is essential in living beings for the life process.
जन्तु वा वनस्पतिको शरीरमा पानीको निश्चित मात्रा हुन्छ।	Water is present in a certain percentage in the body of plants and animals.
यस किसिमको पानीको मात्रालाई जीवहरूले खाद्य पदार्थका माध्यमबाट वा शोषण गरेर आपूर्ति गर्दछन्।	This amount of water is supplied from food and absorbed by an organism.
शरीरमा हुने विभिन्न जैविक रासायनिक प्रक्रियाहरू सञ्चालन गर्नका लागि पानी आवश्यक पर्दछ।	Water is essential for the conduction of biochemical processes in the body.
शारीरिक उपापचयन प्रक्रियाका लागि जीवजन्तुलाई पानीको मात्रा फरक-फरक रूपमा चाहिन्छ।	Organisms require water in different amounts for physiological metabolism.
पानी नभएका ठाउँमा जनावर तथा वनस्पतिलाई जीवन जीउन गाह्रो हुन्छ।	It is difficult for plants and animals to live in a water-deficit place.
अजैविक तत्वमध्ये माटो पनि महŒवपूर्ण तत्व हो।	Soil is also an important component of the abiotic factor.
माटोमा खनिज तत्वहरू, प्राङ्गारिक पदार्थ, जीवाणु तथा रासायनिक तत्वहरू जस्तै नाइट्रोजन, फस्फोरस, पोटासियम आदि हुन्छन् जुन बोटबिरुवाका लागि आवश्यक हुन्छ।	Soil contains minerals, organic matter, bacteria, and chemicals like nitrogen, phosphorus, and potassium which are essential for plants.
बोटबिरुवाहरूले जमिनबाट पानी, खनिज जस्ता पदार्थहरू लिन्छन्।	Plants take water and minerals from the soil.
यी तत्वहरूले बोटबिरुवा हुर्कन तथा वृद्धिका लागि सहयोग गर्छन्।	These components help the plant for growth and development.
बिरुवाबाट उत्पादन भएका अन्न, सागपात, फलफूल, घाँसलगायतका वस्तुलाई मानिस तथा अन्य जन्तुहरूले आवश्यकताअनुसार उपभोग गर्छन्।	Humans and other animals consume plant products like grains, vegetables, fruits, and herbs.
मानिसलगायतका जीवहरूको वासस्थान पनि माटोमा नै रहेको हुन्छ।	The habitat or settlement of humans and animals is in the soil.
पानीमा हुने जैविक र अजैविक तत्वहरूबीचको अन्तरसम्बन्धबाट बनेको पारिस्थितिक पद्धतिलाई जलीय पारिस्थितिक पद्धति भनिन्छ।	The ecosystem in water is made by the interrelationship between biotic and abiotic factors called an aquatic ecosystem.
विभिन्न प्रकारका पानीका स्रोतहरूको बनावट र अवस्था फरक-फरक किसिमका हुन्छ।	The structure and condition of the sources of water are different.
यिनीहरूको अवस्थाअनुसार त्यहाँ विभिन्न किसिमका वनस्पति तथा जीवजन्तु पाइन्छन्।	Diverse types of plants and animals are found in different types of water sources due to its structure and formation.
जलीय पारिस्थितिक पद्धतिअन्तर्गत पोखरी, नदी, समुद्र, ताल, सिमसार आदिका पारिस्थितिक पद्धति पर्दछन्।	The aquatic ecosystem includes the ecosystem of ponds, rivers, oceans, lakes, wetlands, etc.
यी विभिन्न किसिमका जलीय पद्धतिमध्ये यहाँ पोखरीका पारिस्थितिक पद्धतिका वर्णन गरिएको छ।	Here is a description of the pond ecosystem which has the following biotic and abiotic components.
पोखरीका पारिस्थितिक पद्धतिमा निम्नलिखित जैविक र अजैविक तत्वहरू पाइन्छन्।	The pond ecosystem includes the following biotic and abiotic components.
पोखरीमा हुने जैविक र अजैविक तत्वहरूबीचको अन्तरसम्बन्धलाई पोखरीको पारिस्थितिक पद्धति भनिन्छ।	The interrelationship between biotic and abiotic factors in the pond is called the pond ecosystem.
पोखरीमा हुने अजैविक र जैविक तत्वहरूलाई निम्नानुसार उल्लेख गर्न सकिन्छ।	The abiotic and biotic factors in the pond ecosystem are described below:
पोखरीको पारिस्थितिक पद्धतिका अजैविक तत्वअन्तर्गत खनिज पदार्थ, पानी, माटो, प्रकाश, ताप, अक्सिजन, कार्बन डाइअक्साइड ग्याँस, नाइट्रोजन आदि रहेका हुन्छन्।	Minerals, water, soil, light, heat, oxygen, carbon dioxide, nitrogen, etc. are the abiotic factors in the pond ecosystem.
पानीमा घुलनशील अक्सिजन लिई माछाले श्वासप्रश्वास गर्छन्।	Fish respire by taking soluble oxygen in the water.
पोखरीका पिँधसम्म प्रकाशका किरणहरू पुग्छन् जसले गर्दा पोखरीमा भएका वनस्पतिले पानीमा घुलिएको कार्बन डाइअक्साइड र पानीको प्रयोग गरी खाना बनाउँछन्।	Lightrays reach up to the bottom of the pond from where plants prepare food material by the use of soluble carbon dioxide and water in the pond.
यसका अलावा वनस्पतिले पोखरीमा भएका नाइट्रेट लवणहरू सोसेर लिन्छन्।	Besides this, the plant absorbs the nitrate salt of the pond.
त्यहाँ भएका जैविक समुदायमा हुने सजीवहरू खान र बाँच्नका लागि अजैविक तत्वहरूमा भर पर्दछन् र एक अर्कामा आश्रित हुन्छन्।	The biotic community in the pond depends on the abiotic component for food and shelter and is interdependent on each other.
पोखरीको पारिस्थितिक पद्धतिअन्तर्गत पोखरीमा भएका हरिया वनस्पति उत्पादक, उत्पादकलाई खाएर बाँच्ने किरा फट्याङ्ग्रा, साना माछा, भ्यागुता, ठूला माछा, सर्प आदि उपभोक्ता हुन् भने ब्याक्टेरिया विच्छेदक हुन्।	The green plants are the producers in the pond ecosystem. The producer feeder insects, grasshoppers, small fish, frogs, large fish, snakes, etc. in the pond ecosystem are consumers whereas bacteria are decomposers.
पोखरीमा उम्रने भोल्भक्स, क्लामाइडोमोनस, क्लोस्टेरियम लगायतका लेउहरू उत्पादक हुन्।	The algae including Volvox, Chlamydomonas, Clostridium in the pond are the producers.
पानीमा पाइने सूक्ष्म वनस्पतिहरूलाई फाइटोप्लाङ्कटन भनिन्छ।	The microorganisms in the pond are called phytoplankton.
फाइटोप्लाङ्कटन, पिस्टिया र हाइड्रिला जस्ता हरिया वनस्पतिहरूले सौर्य शक्तिबाट खाना तयार गर्छन्।	The green plants like phytoplankton, Pistia, and Hydrilla prepare food from solar energy.
उत्पादकलाई खाएर बाँच्ने सजीवहरूलाई उपभोक्ता भनिन्छ।	The living beings that have to feed on producers to survive are called consumers.
यी सजीवहरू परपोषक हुन्छन् र आफ्नो खानाका लागि उत्पादकमा प्रत्यक्ष रूपमा भर पर्छन्।	These living beings are heterotrophic and depend on the producer for food.
पोखरीमा हुने उपभोक्ता निम्नानुसार छन्।	The following are the consumers in the pond.
पानीमा हुने शाकाहारी सजीवहरू जसले उत्पादकलाई खाएर बाँच्छन् तिनलाई प्राथमिक उपभोक्ता भनिन्छ।	Herbivores living beings in the pond that feed on plants to survive are called primary consumers.
यिनीहरू पोखरीमा भएका सूक्ष्म वनस्पति खाएर बाँच्छन्।	They survive by taking microorganisms from the pond.
यस्ता सूक्ष्म जीवहरूलाई जुप्लाङ्कटन भनिन्छ, जस्तै: साइक्लोप्स, डाफ्निया, बीटल्स, मोलस्क्स आदि।	These microorganisms are known as zooplankton, such as Cyclops, Daphnia, beetles, mollusks, etc.
पोखरीमा हुने साना माछा, चेपाङ्गा, गड्यौला आदि प्राथमिक उपभोक्ता हुन्।	Small fish, tadpoles, and earthworms are the primary consumers in the pond ecosystem.
प्राथमिक उपभोक्तालाई खाएर बाँच्ने जीवलाई द्वितीय उपभोक्ता भनिन्छ।	The organisms that survive from the feeding of the primary consumer are called secondary consumers.
पोखरीमा भएका साना माछालाई खाएर बाँच्ने भ्यागुता, गँगटा, ठूला माछा द्वितीय उपभोक्ता हुन्।	Frogs, crabs, and large fish, which depend on small fish in the pond, are secondary consumers.
यदि सर्प पनि पोखरीमा भएको खण्डमा सर्पले भ्यागुता खाएर बाँच्ने भएकाले यसलाई तृतीय उपभोक्ताका रूपमा लिइन्छ।	If the snake is present in the pond, it is considered a tertiary consumer since it consumes the frog.
पोखरीमा भएका उत्पादक तथा उपभोक्ताहरू मरेपछि, त्यहाँ भएका सूक्ष्म जीवाणुहरू ब्याक्टेरिया, फन्जाई आदिले मरेका जीवहरूलाई कुहाउन, सडाउन कार्य गर्छन्।	The dead organisms are decomposed by microbes like bacteria and fungi when the producers and consumers in the pond die.
त्यसपछि ती विच्छेदकले मरेका जीवहरूलाई सरल अणुमा परिणत गर्छन् र माटामा मिलाउँछन्।	Then, the decomposers convert them into simple molecules which are easily mixed in soil and absorbed by the plant.
यसरी यो प्रक्रिया निरन्तर चलिरहेको हुन्छ।	In this way, this process is operated continuously.
वरिपरिका पोखरी भ्रमण गर्नुहोस्।	Visit the pond in your surroundings.
त्यस वातावरणमा भएका जैविक र अजैविक तत्वहरूको अध्ययन तथा अवलोकन गर्नुहोस् र निम्नानुसार तालिका भर्नुहोस्।	Study and observe the biotic and abiotic components in this environment and fill the given table below.
अवलोकन र अध्ययन गरेका आधारमा पोखरीको पारिस्थितिक पद्धतिको चित्र बनाई कक्षामा प्रस्तुत गर्नुहोस्।	Draw the diagram of the pond ecosystem based on observation and study and present it in class.
जीवन प्रक्रिया सञ्चालन गर्नका लागि शक्ति चाहिन्छ।	Energy is required for the life process.
शक्ति खानाबाट प्राप्त हुन्छ।	Energy is obtained from food.
हरिया वनस्पतिले प्रकाश संश्लेषणबाट खाना तयार गर्छन्।	Green plants prepare food by photosynthesis.
जन्तुहरूमा हरितकण नभएका कारणले आफ्ना खाना आफैं बनाउन सक्दैनन्।	Animals do not prepare their food due to the absence of chlorophyll.
यिनीहरूले उत्पादकबाट खाना प्राप्त गर्छन्।	They take food from the producers.
उदाहरणका लागि फाइटोप्लाङ्कटन, घाँसलाई किरा फट्याङ्ग्राले खान्छन्।	For example, insects consume phytoplankton and grass.
किरा फट्याङ्ग्राहरूलाई खाएर चरा, भ्यागुता बाँचिरहेका हुन्छन्।	Birds and frogs survive by consuming insects.
माछाले पानीमा पाइने साना जीवलाई खान्छ, फेरि सर्प, बकुल्लाले माछालाई खान्छ।	Fish eat the small organisms in the pond and fish are eaten by snakes and herons.
